{
  "ticket_id": "TASK-VIB-008",
  "title": "Add MCP Resources to Ticket Server",
  "description": "The MCP ticket server (after TASK-VIB-003 makes it functional) exposes no MCP Resources. Resources allow agents and tools to read structured ticket data without calling a tool \u2014 they are accessible via `resources/read` RPC.\n\nFix: Add MCP Resources to `server.py` using the `@mcp.resource()` decorator pattern:\n- `ticket://READY` \u2014 returns JSON array of all READY ticket summaries `[{id, title, type, priority}]`\n- `ticket://{ticket-id}` \u2014 returns full ticket JSON for a specific ticket (404-style error if not found)\n- `ticket://DONE` \u2014 returns JSON array of completed tickets with completion timestamps\n\nResource implementations read from `ticket-state/READY/` and `ticket-state/DONE/` directories.",
  "type": "backend",
  "priority": "high",
  "stage": "SECURITY",
  "sdlc_flow": [
    "READY",
    "BACKEND",
    "QA",
    "SECURITY",
    "CI",
    "DOCS",
    "VALIDATION",
    "DONE"
  ],
  "created_at": "2026-03-26T13:19:04.702464+00:00",
  "created_by": "TODO",
  "dependencies": [
    "TASK-VIB-003"
  ],
  "blocked_by": [],
  "file_paths": [
    ".github/mcp-servers/ticket-server/server.py"
  ],
  "acceptance_criteria": [
    "Given the updated server.py, When a MCP client calls `resources/list`, Then `ticket://READY`, `ticket://DONE`, and `ticket://{ticket-id}` (as a URI template) are returned",
    "Given READY tickets exist, When `ticket://READY` resource is read, Then a JSON array of READY ticket summaries is returned",
    "Given a valid ticket ID, When `ticket://{ticket-id}` resource is read with that ID, Then the full ticket JSON is returned",
    "Given an invalid ticket ID, When `ticket://{ticket-id}` resource is read, Then an appropriate error response is returned (not a server crash)",
    "Given completed tickets, When `ticket://DONE` resource is read, Then a JSON array of done ticket summaries with completion timestamps is returned"
  ],
  "rework_count": 0,
  "claimed_by": "Security",
  "machine_id": "pop-os",
  "operator": "reaperoak",
  "lease_expiry": "2026-03-27T06:26:30.721851+00:00",
  "lease_duration_minutes": 30,
  "history": [
    {
      "timestamp": "2026-03-26T13:19:04.702466+00:00",
      "event": "CREATED",
      "agent": "TODO",
      "machine_id": "system",
      "details": "Ticket created from TODO/tasks/L3-vibecoding-improvements.md"
    },
    {
      "timestamp": "2026-03-26T20:10:53.080805+00:00",
      "event": "MOVED_TO_READY",
      "agent": "tickets.py",
      "machine_id": "system",
      "details": "Dependencies resolved, moved to READY"
    },
    {
      "timestamp": "2026-03-27T05:40:00.370517+00:00",
      "event": "CLAIMED",
      "agent": "Backend",
      "machine_id": "pop-os",
      "from_stage": "READY",
      "to_stage": "READY",
      "details": "Claimed by reaperoak@pop-os via Backend, lease until 2026-03-27T06:10:00.370499+00:00"
    },
    {
      "timestamp": "2026-03-27T05:44:05.930887+00:00",
      "event": "STAGE_COMPLETED",
      "agent": "Backend",
      "machine_id": "system",
      "from_stage": "READY",
      "to_stage": "BACKEND",
      "details": "Advanced from READY to BACKEND"
    },
    {
      "timestamp": "2026-03-27T05:44:05.998576+00:00",
      "event": "STAGE_COMPLETED",
      "agent": "Backend",
      "machine_id": "system",
      "from_stage": "BACKEND",
      "to_stage": "QA",
      "details": "Advanced from BACKEND to QA"
    },
    {
      "timestamp": "2026-03-27T05:47:03.145973+00:00",
      "event": "CLAIMED",
      "agent": "QA",
      "machine_id": "pop-os",
      "from_stage": "QA",
      "to_stage": "QA",
      "details": "Claimed by reaperoak@pop-os via QA, lease until 2026-03-27T06:17:03.145956+00:00"
    },
    {
      "timestamp": "2026-03-27T05:55:40.551065+00:00",
      "event": "STAGE_COMPLETED",
      "agent": "QA",
      "machine_id": "system",
      "from_stage": "QA",
      "to_stage": "SECURITY",
      "details": "Advanced from QA to SECURITY"
    },
    {
      "timestamp": "2026-03-27T05:56:30.721873+00:00",
      "event": "CLAIMED",
      "agent": "Security",
      "machine_id": "pop-os",
      "from_stage": "SECURITY",
      "to_stage": "SECURITY",
      "details": "Claimed by reaperoak@pop-os via Security, lease until 2026-03-27T06:26:30.721851+00:00"
    }
  ],
  "source_task_file": "TODO/tasks/L3-vibecoding-improvements.md",
  "tags": [
    "p2",
    "mcp-server",
    "resources",
    "ticket-state"
  ]
}
