{
  "ticket_id": "TASK-SYS-021",
  "title": "Add tools field to prompt files",
  "description": "Add `tools` field to prompt files to scope tool availability per workflow. The start prompt prioritizes research/planning tools, the figma-to-code prompt prioritizes Figma MCP tools, etc.",
  "type": "architecture",
  "priority": "medium",
  "stage": "READY",
  "sdlc_flow": [
    "READY",
    "ARCHITECT",
    "DOCS",
    "VALIDATION",
    "DONE"
  ],
  "created_at": "2026-03-17T15:54:38.857110+00:00",
  "created_by": "TODO",
  "dependencies": [
    "TASK-SYS-020"
  ],
  "blocked_by": [],
  "file_paths": [
    ".github/prompts/start.prompt.md",
    ".github/prompts/continue.prompt.md",
    ".github/prompts/figma-to-code.prompt.md"
  ],
  "acceptance_criteria": [
    "Given start.prompt.md specifies tools, when CTO runs via /start, then only CTO-appropriate tools are available",
    "Given figma-to-code.prompt.md specifies tools, when invoked, then Figma MCP tools are prioritized",
    "Given prompt file tools take precedence over agent defaults, when both are present, then the prompt file tools win"
  ],
  "rework_count": 0,
  "claimed_by": null,
  "machine_id": null,
  "operator": null,
  "lease_expiry": null,
  "lease_duration_minutes": 30,
  "history": [
    {
      "timestamp": "2026-03-17T15:54:38.857112+00:00",
      "event": "CREATED",
      "agent": "TODO",
      "machine_id": "system",
      "details": "Ticket created from TODO/tasks/L3-prompt-instruction-optimization.md"
    },
    {
      "timestamp": "2026-03-26T10:16:19.771420+00:00",
      "event": "MOVED_TO_READY",
      "agent": "tickets.py",
      "machine_id": "system",
      "details": "Dependencies resolved, moved to READY"
    }
  ],
  "source_task_file": "TODO/tasks/L3-prompt-instruction-optimization.md",
  "tags": [
    "prompts",
    "tools",
    "P2"
  ]
}
