{
  "ticket_id": "TASK-SYS-030",
  "title": "Set non-user-facing visibility on dispatch-only agents",
  "description": "Set `user-invocable: false` in the YAML frontmatter of all agents that are only dispatched by Ticketer or CTO and should never be invoked directly by users. Affected agents: Backend, Frontend, QA, Security, CIReviewer, Documentation, Validator, TODO. CTO, Ticketer, Research, ProductManager, Architect, UIDesigner, DevOps remain `user-invocable: true`.",
  "type": "architecture",
  "priority": "high",
  "stage": "DONE",
  "sdlc_flow": [
    "READY",
    "ARCHITECT",
    "DOCS",
    "VALIDATION",
    "DONE"
  ],
  "created_at": "2026-03-25T17:04:52.591572+00:00",
  "created_by": "TODO",
  "dependencies": [],
  "blocked_by": [],
  "file_paths": [
    ".github/agents/Backend.agent.md",
    ".github/agents/Frontend.agent.md",
    ".github/agents/QA.agent.md",
    ".github/agents/Security.agent.md",
    ".github/agents/CIReviewer.agent.md",
    ".github/agents/Documentation.agent.md",
    ".github/agents/Validator.agent.md",
    ".github/agents/TODO.agent.md"
  ],
  "acceptance_criteria": [
    "Given Backend.agent.md, When frontmatter is read, Then user-invocable is false",
    "Given Frontend.agent.md, When frontmatter is read, Then user-invocable is false",
    "Given QA.agent.md, When frontmatter is read, Then user-invocable is false",
    "Given Security.agent.md, When frontmatter is read, Then user-invocable is false",
    "Given CIReviewer.agent.md, When frontmatter is read, Then user-invocable is false",
    "Given Documentation.agent.md, When frontmatter is read, Then user-invocable is false",
    "Given Validator.agent.md, When frontmatter is read, Then user-invocable is false",
    "Given TODO.agent.md, When frontmatter is read, Then user-invocable is false",
    "CTO and Ticketer remain user-invocable true"
  ],
  "rework_count": 0,
  "claimed_by": null,
  "machine_id": null,
  "operator": null,
  "lease_expiry": null,
  "lease_duration_minutes": 30,
  "history": [
    {
      "timestamp": "2026-03-25T17:04:52.591587+00:00",
      "event": "CREATED",
      "agent": "TODO",
      "machine_id": "system",
      "details": "Ticket created from TODO/tasks/EP1-agent-visibility.md"
    },
    {
      "timestamp": "2026-03-25T17:05:15.445786+00:00",
      "event": "MOVED_TO_READY",
      "agent": "tickets.py",
      "machine_id": "system",
      "details": "Dependencies resolved, moved to READY"
    },
    {
      "timestamp": "2026-03-26T10:31:51.506026+00:00",
      "event": "CLAIMED",
      "agent": "Architect",
      "machine_id": "pop-os",
      "from_stage": "READY",
      "to_stage": "READY",
      "details": "Claimed by reaperoak@pop-os via Architect, lease until 2026-03-26T11:01:51.506008+00:00"
    },
    {
      "timestamp": "2026-03-26T10:33:14.377721+00:00",
      "event": "STAGE_COMPLETED",
      "agent": "Architect",
      "machine_id": "system",
      "from_stage": "READY",
      "to_stage": "ARCHITECT",
      "details": "Advanced from READY to ARCHITECT"
    },
    {
      "timestamp": "2026-03-26T10:33:14.416967+00:00",
      "event": "STAGE_COMPLETED",
      "agent": "Architect",
      "machine_id": "system",
      "from_stage": "ARCHITECT",
      "to_stage": "DOCS",
      "details": "Advanced from ARCHITECT to DOCS"
    },
    {
      "timestamp": "2026-03-26T10:33:14.452441+00:00",
      "event": "STAGE_COMPLETED",
      "agent": "Architect",
      "machine_id": "system",
      "from_stage": "DOCS",
      "to_stage": "VALIDATION",
      "details": "Advanced from DOCS to VALIDATION"
    },
    {
      "timestamp": "2026-03-26T10:33:19.393061+00:00",
      "event": "STAGE_COMPLETED",
      "agent": "Validator",
      "machine_id": "system",
      "from_stage": "VALIDATION",
      "to_stage": "DONE",
      "details": "Advanced from VALIDATION to DONE"
    }
  ],
  "source_task_file": "TODO/tasks/EP1-agent-visibility.md",
  "tags": [
    "agent-visibility",
    "frontmatter",
    "EP1"
  ]
}
