{
  "ticket_id": "TASK-ARC-013",
  "title": "Audit and tighten CTO tool loadout",
  "description": "Audit the CTO agent tool array and remove tools not needed for its discovery/research/delegation role. CTO does not implement code, so should not have code-modification tools beyond what's needed for reading. Replace individual tool listings with tool set references where possible.",
  "type": "architecture",
  "priority": "high",
  "stage": "DONE",
  "sdlc_flow": [
    "READY",
    "ARCHITECT",
    "DOCS",
    "VALIDATION",
    "DONE"
  ],
  "created_at": "2026-03-17T15:54:38.855307+00:00",
  "created_by": "TODO",
  "dependencies": [],
  "blocked_by": [],
  "file_paths": [
    ".github/agents/CTO.agent.md"
  ],
  "acceptance_criteria": [
    "Given CTO.agent.md tools array is reviewed, when compared to role needs, then only discovery/research/delegation tools remain",
    "Given CTO does not implement code, when tools are audited, then unnecessary code-modification tools are removed",
    "Given tool sets are available, when applicable, then individual tool listings are replaced with tool set references"
  ],
  "rework_count": 0,
  "claimed_by": null,
  "machine_id": null,
  "operator": null,
  "lease_expiry": null,
  "lease_duration_minutes": 30,
  "history": [
    {
      "timestamp": "2026-03-17T15:54:38.855318+00:00",
      "event": "CREATED",
      "agent": "TODO",
      "machine_id": "system",
      "details": "Ticket created from TODO/tasks/L3-agent-hardening.md"
    },
    {
      "timestamp": "2026-03-17T15:54:38.860462+00:00",
      "event": "MOVED_TO_READY",
      "agent": "tickets.py",
      "machine_id": "system",
      "details": "Dependencies resolved, moved to READY"
    },
    {
      "timestamp": "2026-03-26T10:17:02.756079+00:00",
      "event": "CLAIMED",
      "agent": "Architect",
      "machine_id": "pop-os",
      "from_stage": "READY",
      "to_stage": "READY",
      "details": "Claimed by reaperoak@pop-os via Architect, lease until 2026-03-26T10:47:02.756062+00:00"
    },
    {
      "timestamp": "2026-03-26T10:18:50.764782+00:00",
      "event": "STAGE_COMPLETED",
      "agent": "Architect",
      "machine_id": "system",
      "from_stage": "READY",
      "to_stage": "ARCHITECT",
      "details": "Advanced from READY to ARCHITECT"
    },
    {
      "timestamp": "2026-03-26T10:18:50.798749+00:00",
      "event": "STAGE_COMPLETED",
      "agent": "Architect",
      "machine_id": "system",
      "from_stage": "ARCHITECT",
      "to_stage": "DOCS",
      "details": "Advanced from ARCHITECT to DOCS"
    },
    {
      "timestamp": "2026-03-26T10:18:50.832289+00:00",
      "event": "STAGE_COMPLETED",
      "agent": "Documentation",
      "machine_id": "system",
      "from_stage": "DOCS",
      "to_stage": "VALIDATION",
      "details": "Advanced from DOCS to VALIDATION"
    },
    {
      "timestamp": "2026-03-26T10:18:50.867164+00:00",
      "event": "STAGE_COMPLETED",
      "agent": "Validator",
      "machine_id": "system",
      "from_stage": "VALIDATION",
      "to_stage": "DONE",
      "details": "Advanced from VALIDATION to DONE"
    }
  ],
  "source_task_file": "TODO/tasks/L3-agent-hardening.md",
  "tags": [
    "tools",
    "audit",
    "P1"
  ]
}
