{
  "ticket_id": "TASK-VIB-012",
  "title": "Add TreeView Provider for Ticket State",
  "description": "The VS Code extension has no UI for ticket state. A TreeView provider showing tickets grouped by stage directory provides visual feedback on the pipeline.\n\nFix:\n1. Create `extension/src/ticketTreeProvider.ts` implementing `vscode.TreeDataProvider<TicketTreeItem>`\n2. The tree root shows stage groups: READY, IN_PROGRESS (all active stages), DONE\n3. Each group expands to show individual ticket items (ticket ID + title, with type icon)\n4. Register the provider with `vscode.window.createTreeView('vibecoding.tickets', {...})`\n5. Update `extension/package.json` with `contributes.viewsContainers` (sidebar) and `contributes.views.vibecoding-sidebar`\n6. Add a `vibecoding.refreshTickets` command that calls `provider.refresh()`",
  "type": "backend",
  "priority": "medium",
  "stage": "BACKEND",
  "sdlc_flow": [
    "READY",
    "BACKEND",
    "QA",
    "SECURITY",
    "CI",
    "DOCS",
    "VALIDATION",
    "DONE"
  ],
  "created_at": "2026-03-26T13:19:04.702819+00:00",
  "created_by": "TODO",
  "dependencies": [
    "TASK-VIB-001"
  ],
  "blocked_by": [],
  "file_paths": [
    "extension/src/extension.ts",
    "extension/src/ticketTreeProvider.ts",
    "extension/package.json"
  ],
  "acceptance_criteria": [
    "Given the updated extension is activated, When the VS Code sidebar is opened, Then a \"Vibecoding Tickets\" panel appears in the activity bar",
    "Given READY tickets exist in `ticket-state/READY/`, When the tree is expanded, Then a READY group shows individual ticket items with their IDs and titles",
    "Given DONE tickets exist in `ticket-state/DONE/`, When the tree is expanded, Then a DONE group shows completed ticket items",
    "Given a `vibecoding.refreshTickets` command is invoked, When executed, Then the TreeView re-reads all state directories and refreshes the displayed items",
    "Given `extension/package.json`, When audited, Then it contains valid `contributes.viewsContainers` and `contributes.views` entries for the sidebar panel"
  ],
  "rework_count": 1,
  "claimed_by": null,
  "machine_id": null,
  "operator": null,
  "lease_expiry": null,
  "lease_duration_minutes": 30,
  "history": [
    {
      "timestamp": "2026-03-26T13:19:04.702820+00:00",
      "event": "CREATED",
      "agent": "TODO",
      "machine_id": "system",
      "details": "Ticket created from TODO/tasks/L3-vibecoding-improvements.md"
    },
    {
      "timestamp": "2026-03-26T20:10:53.085117+00:00",
      "event": "MOVED_TO_READY",
      "agent": "tickets.py",
      "machine_id": "system",
      "details": "Dependencies resolved, moved to READY"
    },
    {
      "timestamp": "2026-03-27T08:54:45.006350+00:00",
      "event": "STAGE_COMPLETED",
      "agent": "Backend",
      "machine_id": "system",
      "from_stage": "BACKEND",
      "to_stage": "QA",
      "details": "Advanced from BACKEND to QA"
    },
    {
      "timestamp": "2026-03-27T09:05:53.869661+00:00",
      "event": "STAGE_COMPLETED",
      "agent": "Security",
      "machine_id": "system",
      "from_stage": "SECURITY",
      "to_stage": "CI",
      "details": "Advanced from SECURITY to CI"
    },
    {
      "timestamp": "2026-03-27T09:05:54.024002+00:00",
      "event": "STAGE_COMPLETED",
      "agent": "Security",
      "machine_id": "system",
      "from_stage": "CI",
      "to_stage": "DOCS",
      "details": "Advanced from CI to DOCS"
    },
    {
      "timestamp": "2026-03-27T09:23:54.937775+00:00",
      "event": "STAGE_COMPLETED",
      "agent": "CIReviewer",
      "machine_id": "system",
      "from_stage": "CI",
      "to_stage": "DOCS",
      "details": "Advanced from CI to DOCS"
    },
    {
      "timestamp": "2026-03-27T09:26:44.949341+00:00",
      "event": "STAGE_COMPLETED",
      "agent": "CIReviewer",
      "machine_id": "system",
      "from_stage": "DOCS",
      "to_stage": "VALIDATION",
      "details": "Advanced from DOCS to VALIDATION"
    },
    {
      "timestamp": "2026-03-27T09:38:08.203232+00:00",
      "event": "REWORK",
      "agent": "Validator",
      "machine_id": "system",
      "from_stage": "VALIDATION",
      "to_stage": "BACKEND",
      "details": "Rework #1: Validation rejected: missing QA and DOCS stage artifacts/commits; lint gate not runnable; >=80% new-code coverage evidence missing."
    }
  ],
  "source_task_file": "TODO/tasks/L3-vibecoding-improvements.md",
  "tags": [
    "p3",
    "extension",
    "treeview",
    "ticket-state",
    "ui"
  ]
}
