{
  "ticket_id": "TASK-SYS-031",
  "title": "Add complete post-impl handoff chain to implementing agents",
  "description": "Ensure all implementing agents (Backend, Frontend, Architect, DevOps, Research) declare the complete post-implementation handoff chain in their frontmatter: QA, Security, CIReviewer, Documentation, Validator in order. Each handoff entry must include label, target agent, prompt, and send false.",
  "type": "architecture",
  "priority": "high",
  "stage": "DONE",
  "sdlc_flow": [
    "READY",
    "ARCHITECT",
    "DOCS",
    "VALIDATION",
    "DONE"
  ],
  "created_at": "2026-03-25T17:04:52.592022+00:00",
  "created_by": "TODO",
  "dependencies": [],
  "blocked_by": [],
  "file_paths": [
    ".github/agents/Backend.agent.md",
    ".github/agents/Frontend.agent.md",
    ".github/agents/Architect.agent.md",
    ".github/agents/DevOps.agent.md",
    ".github/agents/Research.agent.md"
  ],
  "acceptance_criteria": [
    "Backend.agent.md handoffs include QA, Security, CIReviewer, Documentation, Validator",
    "Frontend.agent.md handoffs include QA, Security, CIReviewer, Documentation, Validator",
    "Architect.agent.md handoffs include QA, Security, CIReviewer, Documentation, Validator",
    "DevOps.agent.md handoffs include QA, Security, CIReviewer, Documentation, Validator",
    "Research.agent.md handoffs include QA, Security, CIReviewer, Documentation, Validator",
    "Each handoff entry includes label, agent, prompt, and send false"
  ],
  "rework_count": 0,
  "claimed_by": null,
  "machine_id": null,
  "operator": null,
  "lease_expiry": null,
  "lease_duration_minutes": 30,
  "history": [
    {
      "timestamp": "2026-03-25T17:04:52.592031+00:00",
      "event": "CREATED",
      "agent": "TODO",
      "machine_id": "system",
      "details": "Ticket created from TODO/tasks/EP2-handoff-completeness.md"
    },
    {
      "timestamp": "2026-03-25T17:05:15.444996+00:00",
      "event": "MOVED_TO_READY",
      "agent": "tickets.py",
      "machine_id": "system",
      "details": "Dependencies resolved, moved to READY"
    },
    {
      "timestamp": "2026-03-26T10:58:44.997485+00:00",
      "event": "CLAIMED",
      "agent": "Architect",
      "machine_id": "pop-os",
      "from_stage": "READY",
      "to_stage": "READY",
      "details": "Claimed by reaperoak@pop-os via Architect, lease until 2026-03-26T11:28:44.997469+00:00"
    },
    {
      "timestamp": "2026-03-26T11:02:04.452196+00:00",
      "event": "STAGE_COMPLETED",
      "agent": "Architect",
      "machine_id": "system",
      "from_stage": "READY",
      "to_stage": "ARCHITECT",
      "details": "Advanced from READY to ARCHITECT"
    },
    {
      "timestamp": "2026-03-26T11:02:04.515482+00:00",
      "event": "STAGE_COMPLETED",
      "agent": "Architect",
      "machine_id": "system",
      "from_stage": "ARCHITECT",
      "to_stage": "DOCS",
      "details": "Advanced from ARCHITECT to DOCS"
    },
    {
      "timestamp": "2026-03-26T11:02:04.605510+00:00",
      "event": "STAGE_COMPLETED",
      "agent": "Architect",
      "machine_id": "system",
      "from_stage": "DOCS",
      "to_stage": "VALIDATION",
      "details": "Advanced from DOCS to VALIDATION"
    },
    {
      "timestamp": "2026-03-26T11:02:04.804741+00:00",
      "event": "STAGE_COMPLETED",
      "agent": "Architect",
      "machine_id": "system",
      "from_stage": "VALIDATION",
      "to_stage": "DONE",
      "details": "Advanced from VALIDATION to DONE"
    }
  ],
  "source_task_file": "TODO/tasks/EP2-handoff-completeness.md",
  "tags": [
    "handoffs",
    "post-impl-chain",
    "EP2"
  ]
}
