{
  "ticket_id": "TASK-SYS-012",
  "title": "Add rework handoffs to review agents",
  "description": "Add rework handoffs to all review agents. When a review agent rejects a ticket, a \"Rework\" handoff button appears that routes back to the original implementing agent with rejection evidence.",
  "type": "architecture",
  "priority": "high",
  "stage": "DONE",
  "sdlc_flow": [
    "READY",
    "ARCHITECT",
    "DOCS",
    "VALIDATION",
    "DONE"
  ],
  "created_at": "2026-03-17T15:54:38.856309+00:00",
  "created_by": "TODO",
  "dependencies": [
    "TASK-SYS-011"
  ],
  "blocked_by": [],
  "file_paths": [
    ".github/agents/QA.agent.md",
    ".github/agents/Security.agent.md",
    ".github/agents/Validator.agent.md",
    ".github/agents/CIReviewer.agent.md"
  ],
  "acceptance_criteria": [
    "Given QA.agent.md includes rework handoffs, when QA rejects a ticket, then a \"Rework: Return to Implementation\" handoff button appears",
    "Given the rework handoff is defined, when clicked, then it routes back to the implementing agent with rejection evidence in the prompt",
    "Given all review agents have rework handoffs, then rejection-initiated rework is a one-click operation"
  ],
  "rework_count": 0,
  "claimed_by": null,
  "machine_id": null,
  "operator": null,
  "lease_expiry": null,
  "lease_duration_minutes": 30,
  "history": [
    {
      "timestamp": "2026-03-17T15:54:38.856310+00:00",
      "event": "CREATED",
      "agent": "TODO",
      "machine_id": "system",
      "details": "Ticket created from TODO/tasks/L3-agent-orchestration.md"
    },
    {
      "timestamp": "2026-03-26T11:06:37.404481+00:00",
      "event": "MOVED_TO_READY",
      "agent": "tickets.py",
      "machine_id": "system",
      "details": "Dependencies resolved, moved to READY"
    },
    {
      "timestamp": "2026-03-26T11:06:49.725579+00:00",
      "event": "CLAIMED",
      "agent": "Architect",
      "machine_id": "pop-os",
      "from_stage": "READY",
      "to_stage": "READY",
      "details": "Claimed by reaperoak@pop-os via Architect, lease until 2026-03-26T11:36:49.725564+00:00"
    },
    {
      "timestamp": "2026-03-26T11:07:54.641656+00:00",
      "event": "STAGE_COMPLETED",
      "agent": "Architect",
      "machine_id": "system",
      "from_stage": "READY",
      "to_stage": "ARCHITECT",
      "details": "Advanced from READY to ARCHITECT"
    },
    {
      "timestamp": "2026-03-26T11:07:54.677248+00:00",
      "event": "STAGE_COMPLETED",
      "agent": "Architect",
      "machine_id": "system",
      "from_stage": "ARCHITECT",
      "to_stage": "DOCS",
      "details": "Advanced from ARCHITECT to DOCS"
    },
    {
      "timestamp": "2026-03-26T11:07:54.723051+00:00",
      "event": "STAGE_COMPLETED",
      "agent": "Architect",
      "machine_id": "system",
      "from_stage": "DOCS",
      "to_stage": "VALIDATION",
      "details": "Advanced from DOCS to VALIDATION"
    },
    {
      "timestamp": "2026-03-26T11:07:54.764896+00:00",
      "event": "STAGE_COMPLETED",
      "agent": "Architect",
      "machine_id": "system",
      "from_stage": "VALIDATION",
      "to_stage": "DONE",
      "details": "Advanced from VALIDATION to DONE"
    }
  ],
  "source_task_file": "TODO/tasks/L3-agent-orchestration.md",
  "tags": [
    "handoffs",
    "rework",
    "P1"
  ]
}
