{
  "ticket_id": "TASK-ARC-015",
  "title": "Audit and tighten implementing agent tool loadouts",
  "description": "Audit all implementing agent tool arrays and ensure each has only role-specific tools plus universal tools. Backend should not have Figma tools, Frontend should not have DB tools, etc. Each agent should have less than 30 tools total.",
  "type": "architecture",
  "priority": "high",
  "stage": "DONE",
  "sdlc_flow": [
    "READY",
    "ARCHITECT",
    "DOCS",
    "VALIDATION",
    "DONE"
  ],
  "created_at": "2026-03-17T15:54:38.855568+00:00",
  "created_by": "TODO",
  "dependencies": [],
  "blocked_by": [],
  "file_paths": [
    ".github/agents/Backend.agent.md",
    ".github/agents/Frontend.agent.md",
    ".github/agents/DevOps.agent.md",
    ".github/agents/UIDesigner.agent.md"
  ],
  "acceptance_criteria": [
    "Given each implementing agent has a defined role, when tools are audited, then they contain only role-specific plus universal tools",
    "Given Backend needs DB tools but not Figma, when Backend tools are listed, then Figma MCP tools are absent",
    "Given Frontend needs UI tools but not DB, when Frontend tools are listed, then MongoDB tools are absent",
    "Given all agents are reviewed, then each implementing agent has fewer than 30 tools"
  ],
  "rework_count": 0,
  "claimed_by": null,
  "machine_id": null,
  "operator": null,
  "lease_expiry": null,
  "lease_duration_minutes": 30,
  "history": [
    {
      "timestamp": "2026-03-17T15:54:38.855570+00:00",
      "event": "CREATED",
      "agent": "TODO",
      "machine_id": "system",
      "details": "Ticket created from TODO/tasks/L3-agent-hardening.md"
    },
    {
      "timestamp": "2026-03-17T15:54:38.859415+00:00",
      "event": "MOVED_TO_READY",
      "agent": "tickets.py",
      "machine_id": "system",
      "details": "Dependencies resolved, moved to READY"
    },
    {
      "timestamp": "2026-03-26T11:04:21.286715+00:00",
      "event": "CLAIMED",
      "agent": "Architect",
      "machine_id": "pop-os",
      "from_stage": "READY",
      "to_stage": "READY",
      "details": "Claimed by reaperoak@pop-os via Architect, lease until 2026-03-26T11:34:21.286698+00:00"
    },
    {
      "timestamp": "2026-03-26T11:06:03.995530+00:00",
      "event": "STAGE_COMPLETED",
      "agent": "Architect",
      "machine_id": "system",
      "from_stage": "READY",
      "to_stage": "ARCHITECT",
      "details": "Advanced from READY to ARCHITECT"
    },
    {
      "timestamp": "2026-03-26T11:06:04.030335+00:00",
      "event": "STAGE_COMPLETED",
      "agent": "Architect",
      "machine_id": "system",
      "from_stage": "ARCHITECT",
      "to_stage": "DOCS",
      "details": "Advanced from ARCHITECT to DOCS"
    },
    {
      "timestamp": "2026-03-26T11:06:04.063806+00:00",
      "event": "STAGE_COMPLETED",
      "agent": "Architect",
      "machine_id": "system",
      "from_stage": "DOCS",
      "to_stage": "VALIDATION",
      "details": "Advanced from DOCS to VALIDATION"
    },
    {
      "timestamp": "2026-03-26T11:06:04.105049+00:00",
      "event": "STAGE_COMPLETED",
      "agent": "Architect",
      "machine_id": "system",
      "from_stage": "VALIDATION",
      "to_stage": "DONE",
      "details": "Advanced from VALIDATION to DONE"
    }
  ],
  "source_task_file": "TODO/tasks/L3-agent-hardening.md",
  "tags": [
    "tools",
    "audit",
    "P1"
  ]
}
