{
  "ticket_id": "TASK-VIB-010",
  "title": "Register MCP Ticket Server as MCP App via Extension",
  "description": "The MCP ticket server should be registered as an MCP App using the VS Code extension's `contributes.mcpServerDefinitionProviders` mechanism so it is available workspace-wide without requiring users to manually edit `.vscode/mcp.json`.\n\nFix:\n1. In `extension/package.json`, add `contributes.mcpServerDefinitionProviders` with a unique provider ID\n2. In `extension/src/extension.ts`, import and call `vscode.lm.registerMcpServerDefinitionProvider` to register the ticket server with its Python script path and environment\n\nThe server definition should point to `.github/mcp-servers/ticket-server/server.py`, use `python3` as the command, and set the workspace root as the cwd.",
  "type": "backend",
  "priority": "medium",
  "stage": "VALIDATION",
  "sdlc_flow": [
    "READY",
    "BACKEND",
    "QA",
    "SECURITY",
    "CI",
    "DOCS",
    "VALIDATION",
    "DONE"
  ],
  "created_at": "2026-03-26T13:19:04.702639+00:00",
  "created_by": "TODO",
  "dependencies": [
    "TASK-VIB-008",
    "TASK-VIB-009"
  ],
  "blocked_by": [],
  "file_paths": [
    "extension/src/extension.ts",
    "extension/package.json"
  ],
  "acceptance_criteria": [
    "Given the updated extension is activated, When VS Code starts, Then the ticket MCP server is registered and available in the MCP server list without manual `mcp.json` configuration",
    "Given `extension/package.json`, When audited, Then it contains a valid `contributes.mcpServerDefinitionProviders` entry with the extension's publisher ID",
    "Given `extension/src/extension.ts`, When audited, Then it calls `vscode.lm.registerMcpServerDefinitionProvider` with the correct server path and provider configuration",
    "Given the registered MCP server, When a MCP client connects, Then all 7 tools plus Resources and Prompts from TASK-VIB-008 and TASK-VIB-009 are accessible"
  ],
  "rework_count": 1,
  "claimed_by": "Validator",
  "machine_id": "dispatcher",
  "operator": "reaperoak",
  "lease_expiry": "2026-04-09T17:42:17.439465Z",
  "lease_duration_minutes": 30,
  "history": [
    {
      "timestamp": "2026-03-26T13:19:04.702641+00:00",
      "event": "CREATED",
      "agent": "TODO",
      "machine_id": "system",
      "details": "Ticket created from TODO/tasks/L3-vibecoding-improvements.md"
    },
    {
      "timestamp": "2026-04-09T16:23:47.326034+00:00",
      "event": "MOVED_TO_READY",
      "agent": "tickets.py",
      "machine_id": "system",
      "details": "Dependencies resolved, moved to READY"
    },
    {
      "timestamp": "2026-04-09T16:29:35.736399+00:00",
      "event": "STAGE_COMPLETED",
      "agent": "Backend",
      "machine_id": "system",
      "from_stage": "BACKEND",
      "to_stage": "QA",
      "details": "Advanced from BACKEND to QA"
    },
    {
      "timestamp": "2026-04-09T16:34:29.280724+00:00",
      "event": "REWORK",
      "agent": "Security",
      "machine_id": "system",
      "from_stage": "SECURITY",
      "to_stage": "BACKEND",
      "details": "Rework #1: High severity vulnerable component detected (lodash GHSA-r5fr-rjxr-66jc via npm audit)"
    },
    {
      "timestamp": "2026-04-09T16:39:59.782883+00:00",
      "event": "STAGE_COMPLETED",
      "agent": "Backend",
      "machine_id": "system",
      "from_stage": "BACKEND",
      "to_stage": "QA",
      "details": "Advanced from BACKEND to QA"
    },
    {
      "timestamp": "2026-04-09T16:58:04.433359+00:00",
      "event": "STAGE_COMPLETED",
      "agent": "QA",
      "machine_id": "system",
      "from_stage": "QA",
      "to_stage": "SECURITY",
      "details": "Advanced from QA to SECURITY"
    },
    {
      "timestamp": "2026-04-09T17:01:39.730904+00:00",
      "event": "STAGE_COMPLETED",
      "agent": "Security",
      "machine_id": "system",
      "from_stage": "SECURITY",
      "to_stage": "CI",
      "details": "Advanced from SECURITY to CI"
    },
    {
      "timestamp": "2026-04-09T17:06:38.920055+00:00",
      "event": "STAGE_COMPLETED",
      "agent": "CIReviewer",
      "machine_id": "system",
      "from_stage": "CI",
      "to_stage": "DOCS",
      "details": "Advanced from CI to DOCS"
    },
    {
      "timestamp": "2026-04-09T17:11:01.993936+00:00",
      "event": "STAGE_COMPLETED",
      "agent": "Documentation",
      "machine_id": "system",
      "from_stage": "DOCS",
      "to_stage": "VALIDATION",
      "details": "Advanced from DOCS to VALIDATION"
    }
  ],
  "source_task_file": "TODO/tasks/L3-vibecoding-improvements.md",
  "tags": [
    "p3",
    "extension",
    "mcp-app",
    "registration"
  ]
}
