{
  "ticket_id": "TASK-ARC-017",
  "title": "Convert all agent reference sections to Markdown links",
  "description": "Convert all agent \"References\" sections from plain text paths to proper Markdown links. When chat.includeReferencedInstructions is enabled, VS Code auto-includes linked instruction content, eliminating the need for agents to manually read referenced files during boot sequence.",
  "type": "architecture",
  "priority": "high",
  "stage": "DONE",
  "sdlc_flow": [
    "READY",
    "ARCHITECT",
    "DOCS",
    "VALIDATION",
    "DONE"
  ],
  "created_at": "2026-03-17T15:54:38.855731+00:00",
  "created_by": "TODO",
  "dependencies": [],
  "blocked_by": [],
  "file_paths": [
    ".github/agents/CTO.agent.md",
    ".github/agents/Ticketer.agent.md",
    ".github/agents/Backend.agent.md",
    ".github/agents/Frontend.agent.md",
    ".github/agents/QA.agent.md",
    ".github/agents/Security.agent.md",
    ".github/agents/Architect.agent.md",
    ".github/agents/Research.agent.md",
    ".github/agents/ProductManager.agent.md",
    ".github/agents/Documentation.agent.md",
    ".github/agents/DevOps.agent.md",
    ".github/agents/UIDesigner.agent.md",
    ".github/agents/CIReviewer.agent.md",
    ".github/agents/Validator.agent.md",
    ".github/agents/TODO.agent.md"
  ],
  "acceptance_criteria": [
    "Given each agent has a References section, when converted, then each reference is a proper Markdown link",
    "Given chat.includeReferencedInstructions is enabled, when an agent is invoked, then referenced instruction content is automatically included",
    "Given all 15 agents are updated, when any agent is invoked, then its referenced instructions are auto-loaded without boot sequence reads"
  ],
  "rework_count": 0,
  "claimed_by": null,
  "machine_id": null,
  "operator": null,
  "lease_expiry": null,
  "lease_duration_minutes": 30,
  "history": [
    {
      "timestamp": "2026-03-17T15:54:38.855733+00:00",
      "event": "CREATED",
      "agent": "TODO",
      "machine_id": "system",
      "details": "Ticket created from TODO/tasks/L3-agent-hardening.md"
    },
    {
      "timestamp": "2026-03-17T15:54:38.859083+00:00",
      "event": "MOVED_TO_READY",
      "agent": "tickets.py",
      "machine_id": "system",
      "details": "Dependencies resolved, moved to READY"
    },
    {
      "timestamp": "2026-03-26T11:04:21.365793+00:00",
      "event": "CLAIMED",
      "agent": "Architect",
      "machine_id": "pop-os",
      "from_stage": "READY",
      "to_stage": "READY",
      "details": "Claimed by reaperoak@pop-os via Architect, lease until 2026-03-26T11:34:21.365779+00:00"
    },
    {
      "timestamp": "2026-03-26T11:06:10.703777+00:00",
      "event": "STAGE_COMPLETED",
      "agent": "Architect",
      "machine_id": "system",
      "from_stage": "READY",
      "to_stage": "ARCHITECT",
      "details": "Advanced from READY to ARCHITECT"
    },
    {
      "timestamp": "2026-03-26T11:06:10.739909+00:00",
      "event": "STAGE_COMPLETED",
      "agent": "Architect",
      "machine_id": "system",
      "from_stage": "ARCHITECT",
      "to_stage": "DOCS",
      "details": "Advanced from ARCHITECT to DOCS"
    },
    {
      "timestamp": "2026-03-26T11:06:10.773111+00:00",
      "event": "STAGE_COMPLETED",
      "agent": "Architect",
      "machine_id": "system",
      "from_stage": "DOCS",
      "to_stage": "VALIDATION",
      "details": "Advanced from DOCS to VALIDATION"
    },
    {
      "timestamp": "2026-03-26T11:06:10.807030+00:00",
      "event": "STAGE_COMPLETED",
      "agent": "Architect",
      "machine_id": "system",
      "from_stage": "VALIDATION",
      "to_stage": "DONE",
      "details": "Advanced from VALIDATION to DONE"
    }
  ],
  "source_task_file": "TODO/tasks/L3-agent-hardening.md",
  "tags": [
    "agents",
    "references",
    "P1"
  ]
}
