{
  "ticket_id": "TASK-VIB-003",
  "title": "Rewrite MCP Ticket Server with FastMCP Transport",
  "description": "`.github/mcp-servers/ticket-server/server.py` defines 7 tool schemas (syncTickets, getStatus, claimTicket, advanceTicket, releaseTicket, reworkTicket, validateIntegrity) but has NO JSON-RPC/stdio transport layer. The server cannot communicate as an MCP server \u2014 it has no `if __name__ == \"__main__\"` entry point and no protocol handling.\n\nFix: Rewrite `server.py` using the `mcp` Python SDK with FastMCP pattern. Keep all 7 tool definitions intact; wrap them with `@mcp.tool()` decorators. Add `mcp.run(transport=\"stdio\")` as the entry point. Create `requirements.txt` with `mcp>=1.0.0` dependency.\n\nThe tool implementations must call `subprocess.run` against `tickets.py` (path: `../../../../tickets.py` relative to server.py) and return structured results.",
  "type": "backend",
  "priority": "critical",
  "stage": "READY",
  "sdlc_flow": [
    "READY",
    "BACKEND",
    "QA",
    "SECURITY",
    "CI",
    "DOCS",
    "VALIDATION",
    "DONE"
  ],
  "created_at": "2026-03-26T13:19:04.701987+00:00",
  "created_by": "TODO",
  "dependencies": [],
  "blocked_by": [],
  "file_paths": [
    ".github/mcp-servers/ticket-server/server.py",
    ".github/mcp-servers/ticket-server/requirements.txt"
  ],
  "acceptance_criteria": [
    "Given the rewritten server.py, When invoked as `python server.py`, Then it starts a valid stdio MCP server without error",
    "Given a connected MCP client, When it calls `listTools`, Then all 7 tools (syncTickets, getStatus, claimTicket, advanceTicket, releaseTicket, reworkTicket, validateIntegrity) are returned with their correct input schemas",
    "Given a connected MCP client, When it calls `syncTickets`, Then the tool runs `tickets.py --sync` and returns the output as a text result",
    "Given a connected MCP client, When it calls `getStatus` with `{\"format\": \"json\"}`, Then the tool returns ticket state as structured JSON",
    "Given a connected MCP client, When it calls `claimTicket` with valid ticket ID/agent/machine/operator, Then the tool claims the ticket and returns success",
    "Given `requirements.txt` exists in the server directory, When `pip install -r requirements.txt` is run, Then `mcp` package installs without error"
  ],
  "rework_count": 0,
  "claimed_by": null,
  "machine_id": null,
  "operator": null,
  "lease_expiry": null,
  "lease_duration_minutes": 30,
  "history": [
    {
      "timestamp": "2026-03-26T13:19:04.701990+00:00",
      "event": "CREATED",
      "agent": "TODO",
      "machine_id": "system",
      "details": "Ticket created from TODO/tasks/L3-vibecoding-improvements.md"
    },
    {
      "timestamp": "2026-03-26T13:19:04.706151+00:00",
      "event": "MOVED_TO_READY",
      "agent": "tickets.py",
      "machine_id": "system",
      "details": "Dependencies resolved, moved to READY"
    }
  ],
  "source_task_file": "TODO/tasks/L3-vibecoding-improvements.md",
  "tags": [
    "p0",
    "mcp-server",
    "transport",
    "fastmcp"
  ]
}
