{
  "ticket_id": "TASK-SYS-008",
  "title": "Add subagent scoping to CTO agent",
  "description": "Add `agents` field to CTO agent frontmatter to scope which subagents CTO can invoke: Research, ProductManager, Architect, TODO only. Add `disable-model-invocation: true` to prevent CTO from being invoked as a subagent by other agents (it's a top-level orchestrator only).",
  "type": "architecture",
  "priority": "critical",
  "stage": "DONE",
  "sdlc_flow": [
    "READY",
    "ARCHITECT",
    "DOCS",
    "VALIDATION",
    "DONE"
  ],
  "created_at": "2026-03-17T15:54:38.856014+00:00",
  "created_by": "TODO",
  "dependencies": [],
  "blocked_by": [],
  "file_paths": [
    ".github/agents/CTO.agent.md"
  ],
  "acceptance_criteria": [
    "Given CTO.agent.md is updated, when the `agents` field is present, then it contains exactly `['Research', 'ProductManager', 'Architect', 'TODO']`",
    "Given CTO.agent.md has `disable-model-invocation: true`, when any other agent tries to invoke CTO as subagent, then VS Code blocks it",
    "Given CTO is invoked, when it attempts to call Backend or Frontend as subagent, then VS Code prevents the invocation"
  ],
  "rework_count": 0,
  "claimed_by": null,
  "machine_id": null,
  "operator": null,
  "lease_expiry": null,
  "lease_duration_minutes": 30,
  "history": [
    {
      "timestamp": "2026-03-17T15:54:38.856016+00:00",
      "event": "CREATED",
      "agent": "TODO",
      "machine_id": "system",
      "details": "Ticket created from TODO/tasks/L3-agent-orchestration.md"
    },
    {
      "timestamp": "2026-03-17T15:54:38.860905+00:00",
      "event": "MOVED_TO_READY",
      "agent": "tickets.py",
      "machine_id": "system",
      "details": "Dependencies resolved, moved to READY"
    },
    {
      "timestamp": "2026-03-26T10:09:39.494126+00:00",
      "event": "CLAIMED",
      "agent": "Architect",
      "machine_id": "pop-os",
      "from_stage": "READY",
      "to_stage": "READY",
      "details": "Claimed by reaperoak@pop-os via Architect, lease until 2026-03-26T10:39:39.494110+00:00"
    },
    {
      "timestamp": "2026-03-26T10:12:38.818442+00:00",
      "event": "STAGE_COMPLETED",
      "agent": "Architect",
      "machine_id": "system",
      "from_stage": "READY",
      "to_stage": "ARCHITECT",
      "details": "Advanced from READY to ARCHITECT"
    },
    {
      "timestamp": "2026-03-26T10:12:49.344483+00:00",
      "event": "STAGE_COMPLETED",
      "agent": "Architect",
      "machine_id": "system",
      "from_stage": "ARCHITECT",
      "to_stage": "DOCS",
      "details": "Advanced from ARCHITECT to DOCS"
    },
    {
      "timestamp": "2026-03-26T10:13:01.860963+00:00",
      "event": "STAGE_COMPLETED",
      "agent": "Documentation",
      "machine_id": "system",
      "from_stage": "DOCS",
      "to_stage": "VALIDATION",
      "details": "Advanced from DOCS to VALIDATION"
    },
    {
      "timestamp": "2026-03-26T10:13:01.894001+00:00",
      "event": "STAGE_COMPLETED",
      "agent": "Validator",
      "machine_id": "system",
      "from_stage": "VALIDATION",
      "to_stage": "DONE",
      "details": "Advanced from VALIDATION to DONE"
    }
  ],
  "source_task_file": "TODO/tasks/L3-agent-orchestration.md",
  "tags": [
    "agents",
    "orchestration",
    "P0"
  ]
}
