{
  "ticket_id": "TASK-SYS-033",
  "title": "Add Ticketer dispatch handoffs for all stage agents",
  "description": "Add handoff entries to Ticketer.agent.md for every agent it dispatches: Architect, Research, ProductManager, Backend, Frontend, DevOps, UIDesigner, QA, Security, CIReviewer, Documentation, Validator. Makes the full dispatch graph explicit.",
  "type": "architecture",
  "priority": "high",
  "stage": "DONE",
  "sdlc_flow": [
    "READY",
    "ARCHITECT",
    "DOCS",
    "VALIDATION",
    "DONE"
  ],
  "created_at": "2026-03-25T17:04:52.592545+00:00",
  "created_by": "TODO",
  "dependencies": [],
  "blocked_by": [],
  "file_paths": [
    ".github/agents/Ticketer.agent.md"
  ],
  "acceptance_criteria": [
    "Ticketer.agent.md handoffs include entries for all 12 dispatchable stage agents",
    "Each handoff includes label, agent, prompt, and send false",
    "No handoff references a nonexistent agent"
  ],
  "rework_count": 0,
  "claimed_by": null,
  "machine_id": null,
  "operator": null,
  "lease_expiry": null,
  "lease_duration_minutes": 30,
  "history": [
    {
      "timestamp": "2026-03-25T17:04:52.592551+00:00",
      "event": "CREATED",
      "agent": "TODO",
      "machine_id": "system",
      "details": "Ticket created from TODO/tasks/EP2-handoff-completeness.md"
    },
    {
      "timestamp": "2026-03-25T17:05:15.447239+00:00",
      "event": "MOVED_TO_READY",
      "agent": "tickets.py",
      "machine_id": "system",
      "details": "Dependencies resolved, moved to READY"
    },
    {
      "timestamp": "2026-03-26T10:53:38.751312+00:00",
      "event": "CLAIMED",
      "agent": "Architect",
      "machine_id": "pop-os",
      "from_stage": "READY",
      "to_stage": "READY",
      "details": "Claimed by reaperoak@pop-os via Architect, lease until 2026-03-26T11:23:38.751288+00:00"
    },
    {
      "timestamp": "2026-03-26T10:57:55.301979+00:00",
      "event": "STAGE_COMPLETED",
      "agent": "Architect",
      "machine_id": "system",
      "from_stage": "READY",
      "to_stage": "ARCHITECT",
      "details": "Advanced from READY to ARCHITECT"
    },
    {
      "timestamp": "2026-03-26T10:57:55.343749+00:00",
      "event": "STAGE_COMPLETED",
      "agent": "Architect",
      "machine_id": "system",
      "from_stage": "ARCHITECT",
      "to_stage": "DOCS",
      "details": "Advanced from ARCHITECT to DOCS"
    },
    {
      "timestamp": "2026-03-26T10:57:55.381829+00:00",
      "event": "STAGE_COMPLETED",
      "agent": "Architect",
      "machine_id": "system",
      "from_stage": "DOCS",
      "to_stage": "VALIDATION",
      "details": "Advanced from DOCS to VALIDATION"
    },
    {
      "timestamp": "2026-03-26T10:57:55.414131+00:00",
      "event": "STAGE_COMPLETED",
      "agent": "Architect",
      "machine_id": "system",
      "from_stage": "VALIDATION",
      "to_stage": "DONE",
      "details": "Advanced from VALIDATION to DONE"
    }
  ],
  "source_task_file": "TODO/tasks/EP2-handoff-completeness.md",
  "tags": [
    "handoffs",
    "dispatch",
    "EP2"
  ]
}
