{
  "ticket_id": "TASK-SYS-029",
  "title": "Create tool sets for common tool groupings",
  "description": "Create reusable tool set definitions that group commonly-used tools. A `#universal` set for tools every agent needs (memory, serena, execute, vscode, tavily, github, sequentialthinking), a `#code-editing` set for implementing agents, and a `#research` set for research/planning agents. Reduces duplication across agent files.",
  "type": "architecture",
  "priority": "medium",
  "stage": "DONE",
  "sdlc_flow": [
    "READY",
    "ARCHITECT",
    "DOCS",
    "VALIDATION",
    "DONE"
  ],
  "created_at": "2026-03-17T15:54:38.857708+00:00",
  "created_by": "TODO",
  "dependencies": [],
  "blocked_by": [],
  "file_paths": [
    ".github/tool-sets/universal.jsonc",
    ".github/tool-sets/code-editing.jsonc",
    ".github/tool-sets/research.jsonc"
  ],
  "acceptance_criteria": [
    "Given a universal.jsonc tool set is created, when agents reference #universal, then all universal tools are included",
    "Given a code-editing.jsonc tool set exists, when implementing agents reference it, then all code editing tools are included",
    "Given tool sets reduce duplication, when agent files are updated, then individual tool listings are replaced with tool set references"
  ],
  "rework_count": 0,
  "claimed_by": null,
  "machine_id": null,
  "operator": null,
  "lease_expiry": null,
  "lease_duration_minutes": 30,
  "history": [
    {
      "timestamp": "2026-03-17T15:54:38.857710+00:00",
      "event": "CREATED",
      "agent": "TODO",
      "machine_id": "system",
      "details": "Ticket created from TODO/tasks/L3-skills-mcp.md"
    },
    {
      "timestamp": "2026-03-17T15:54:38.863198+00:00",
      "event": "MOVED_TO_READY",
      "agent": "tickets.py",
      "machine_id": "system",
      "details": "Dependencies resolved, moved to READY"
    },
    {
      "timestamp": "2026-03-26T10:38:00.730808+00:00",
      "event": "CLAIMED",
      "agent": "Architect",
      "machine_id": "pop-os",
      "from_stage": "READY",
      "to_stage": "READY",
      "details": "Claimed by reaperoak@pop-os via Architect, lease until 2026-03-26T11:08:00.730779+00:00"
    },
    {
      "timestamp": "2026-03-26T10:39:11.880746+00:00",
      "event": "STAGE_COMPLETED",
      "agent": "Architect",
      "machine_id": "system",
      "from_stage": "READY",
      "to_stage": "ARCHITECT",
      "details": "Advanced from READY to ARCHITECT"
    },
    {
      "timestamp": "2026-03-26T10:39:11.920618+00:00",
      "event": "STAGE_COMPLETED",
      "agent": "Architect",
      "machine_id": "system",
      "from_stage": "ARCHITECT",
      "to_stage": "DOCS",
      "details": "Advanced from ARCHITECT to DOCS"
    },
    {
      "timestamp": "2026-03-26T10:39:11.964373+00:00",
      "event": "STAGE_COMPLETED",
      "agent": "Architect",
      "machine_id": "system",
      "from_stage": "DOCS",
      "to_stage": "VALIDATION",
      "details": "Advanced from DOCS to VALIDATION"
    },
    {
      "timestamp": "2026-03-26T10:39:11.998487+00:00",
      "event": "STAGE_COMPLETED",
      "agent": "Validator",
      "machine_id": "system",
      "from_stage": "VALIDATION",
      "to_stage": "DONE",
      "details": "Advanced from VALIDATION to DONE"
    }
  ],
  "source_task_file": "TODO/tasks/L3-skills-mcp.md",
  "tags": [
    "tools",
    "toolsets",
    "P2"
  ]
}
