{
  "ticket_id": "TASK-VIB-008",
  "title": "Add MCP Resources to Ticket Server",
  "description": "The MCP ticket server (after TASK-VIB-003 makes it functional) exposes no MCP Resources. Resources allow agents and tools to read structured ticket data without calling a tool \u2014 they are accessible via `resources/read` RPC.\n\nFix: Add MCP Resources to `server.py` using the `@mcp.resource()` decorator pattern:\n- `ticket://READY` \u2014 returns JSON array of all READY ticket summaries `[{id, title, type, priority}]`\n- `ticket://{ticket-id}` \u2014 returns full ticket JSON for a specific ticket (404-style error if not found)\n- `ticket://DONE` \u2014 returns JSON array of completed tickets with completion timestamps\n\nResource implementations read from `ticket-state/READY/` and `ticket-state/DONE/` directories.",
  "type": "backend",
  "priority": "high",
  "stage": "READY",
  "sdlc_flow": [
    "READY",
    "BACKEND",
    "QA",
    "SECURITY",
    "CI",
    "DOCS",
    "VALIDATION",
    "DONE"
  ],
  "created_at": "2026-03-26T13:19:04.702464+00:00",
  "created_by": "TODO",
  "dependencies": [
    "TASK-VIB-003"
  ],
  "blocked_by": [],
  "file_paths": [
    ".github/mcp-servers/ticket-server/server.py"
  ],
  "acceptance_criteria": [
    "Given the updated server.py, When a MCP client calls `resources/list`, Then `ticket://READY`, `ticket://DONE`, and `ticket://{ticket-id}` (as a URI template) are returned",
    "Given READY tickets exist, When `ticket://READY` resource is read, Then a JSON array of READY ticket summaries is returned",
    "Given a valid ticket ID, When `ticket://{ticket-id}` resource is read with that ID, Then the full ticket JSON is returned",
    "Given an invalid ticket ID, When `ticket://{ticket-id}` resource is read, Then an appropriate error response is returned (not a server crash)",
    "Given completed tickets, When `ticket://DONE` resource is read, Then a JSON array of done ticket summaries with completion timestamps is returned"
  ],
  "rework_count": 0,
  "claimed_by": null,
  "machine_id": null,
  "operator": null,
  "lease_expiry": null,
  "lease_duration_minutes": 30,
  "history": [
    {
      "timestamp": "2026-03-26T13:19:04.702466+00:00",
      "event": "CREATED",
      "agent": "TODO",
      "machine_id": "system",
      "details": "Ticket created from TODO/tasks/L3-vibecoding-improvements.md"
    },
    {
      "timestamp": "2026-03-26T20:10:53.080805+00:00",
      "event": "MOVED_TO_READY",
      "agent": "tickets.py",
      "machine_id": "system",
      "details": "Dependencies resolved, moved to READY"
    }
  ],
  "source_task_file": "TODO/tasks/L3-vibecoding-improvements.md",
  "tags": [
    "p2",
    "mcp-server",
    "resources",
    "ticket-state"
  ]
}
