{
  "ticket_id": "TASK-SYS-009",
  "title": "Add subagent scoping to Ticketer agent",
  "description": "Add `agents` field to Ticketer agent frontmatter to scope which subagents Ticketer can invoke: all implementing and review agents (Backend, Frontend, DevOps, UIDesigner, QA, Security, CIReviewer, Documentation, Validator, TODO). Ticketer must NOT be able to invoke CTO, Research, PM, or Architect.",
  "type": "architecture",
  "priority": "critical",
  "stage": "READY",
  "sdlc_flow": [
    "READY",
    "ARCHITECT",
    "DOCS",
    "VALIDATION",
    "DONE"
  ],
  "created_at": "2026-03-17T15:54:38.856090+00:00",
  "created_by": "TODO",
  "dependencies": [],
  "blocked_by": [],
  "file_paths": [
    ".github/agents/Ticketer.agent.md"
  ],
  "acceptance_criteria": [
    "Given Ticketer.agent.md is updated, when the `agents` field is present, then it lists `['Backend', 'Frontend', 'DevOps', 'UIDesigner', 'QA', 'Security', 'CIReviewer', 'Documentation', 'Validator', 'TODO']`",
    "Given Ticketer is invoked, when it attempts to call CTO or Research as subagent, then VS Code blocks the invocation",
    "Given the agents field is enforced, when Ticketer dispatches a Backend agent, then it succeeds"
  ],
  "rework_count": 0,
  "claimed_by": "Architect",
  "machine_id": "pop-os",
  "operator": "reaperoak",
  "lease_expiry": "2026-03-26T10:39:39.527684+00:00",
  "lease_duration_minutes": 30,
  "history": [
    {
      "timestamp": "2026-03-17T15:54:38.856092+00:00",
      "event": "CREATED",
      "agent": "TODO",
      "machine_id": "system",
      "details": "Ticket created from TODO/tasks/L3-agent-orchestration.md"
    },
    {
      "timestamp": "2026-03-17T15:54:38.864986+00:00",
      "event": "MOVED_TO_READY",
      "agent": "tickets.py",
      "machine_id": "system",
      "details": "Dependencies resolved, moved to READY"
    },
    {
      "timestamp": "2026-03-26T10:09:39.527700+00:00",
      "event": "CLAIMED",
      "agent": "Architect",
      "machine_id": "pop-os",
      "from_stage": "READY",
      "to_stage": "READY",
      "details": "Claimed by reaperoak@pop-os via Architect, lease until 2026-03-26T10:39:39.527684+00:00"
    }
  ],
  "source_task_file": "TODO/tasks/L3-agent-orchestration.md",
  "tags": [
    "agents",
    "orchestration",
    "P0"
  ]
}
