{
  "ticket_id": "TASK-SYS-011",
  "title": "Add SDLC stage handoffs to implementing agents",
  "description": "Add `handoffs` field to all implementing agents for SDLC stage transitions. Each agent gets a handoff to the next stage in the pipeline (Backend\u2192QA, QA\u2192Security, Security\u2192CI, CI\u2192Docs, Docs\u2192Validation). This creates a native workflow chain.",
  "type": "architecture",
  "priority": "high",
  "stage": "DONE",
  "sdlc_flow": [
    "READY",
    "ARCHITECT",
    "DOCS",
    "VALIDATION",
    "DONE"
  ],
  "created_at": "2026-03-17T15:54:38.856237+00:00",
  "created_by": "TODO",
  "dependencies": [
    "TASK-SYS-009"
  ],
  "blocked_by": [],
  "file_paths": [
    ".github/agents/Backend.agent.md",
    ".github/agents/Frontend.agent.md",
    ".github/agents/DevOps.agent.md",
    ".github/agents/Architect.agent.md",
    ".github/agents/Research.agent.md"
  ],
  "acceptance_criteria": [
    "Given Backend.agent.md includes `handoffs`, when Backend completes, then a \"Run QA\" handoff button appears pointing to QA agent",
    "Given each agent has handoffs, then the full chain is: implementing\u2192QA\u2192Security\u2192CI\u2192Docs\u2192Validation",
    "Given handoff prompts include ticket ID context, when clicked, then the next agent receives the ticket ID"
  ],
  "rework_count": 0,
  "claimed_by": null,
  "machine_id": null,
  "operator": null,
  "lease_expiry": null,
  "lease_duration_minutes": 30,
  "history": [
    {
      "timestamp": "2026-03-17T15:54:38.856239+00:00",
      "event": "CREATED",
      "agent": "TODO",
      "machine_id": "system",
      "details": "Ticket created from TODO/tasks/L3-agent-orchestration.md"
    },
    {
      "timestamp": "2026-03-26T10:13:23.502532+00:00",
      "event": "MOVED_TO_READY",
      "agent": "tickets.py",
      "machine_id": "system",
      "details": "Dependencies resolved, moved to READY"
    },
    {
      "timestamp": "2026-03-26T11:04:21.327898+00:00",
      "event": "CLAIMED",
      "agent": "Architect",
      "machine_id": "pop-os",
      "from_stage": "READY",
      "to_stage": "READY",
      "details": "Claimed by reaperoak@pop-os via Architect, lease until 2026-03-26T11:34:21.327878+00:00"
    },
    {
      "timestamp": "2026-03-26T11:06:10.560471+00:00",
      "event": "STAGE_COMPLETED",
      "agent": "Architect",
      "machine_id": "system",
      "from_stage": "READY",
      "to_stage": "ARCHITECT",
      "details": "Advanced from READY to ARCHITECT"
    },
    {
      "timestamp": "2026-03-26T11:06:10.595083+00:00",
      "event": "STAGE_COMPLETED",
      "agent": "Architect",
      "machine_id": "system",
      "from_stage": "ARCHITECT",
      "to_stage": "DOCS",
      "details": "Advanced from ARCHITECT to DOCS"
    },
    {
      "timestamp": "2026-03-26T11:06:10.629037+00:00",
      "event": "STAGE_COMPLETED",
      "agent": "Architect",
      "machine_id": "system",
      "from_stage": "DOCS",
      "to_stage": "VALIDATION",
      "details": "Advanced from DOCS to VALIDATION"
    },
    {
      "timestamp": "2026-03-26T11:06:10.667238+00:00",
      "event": "STAGE_COMPLETED",
      "agent": "Architect",
      "machine_id": "system",
      "from_stage": "VALIDATION",
      "to_stage": "DONE",
      "details": "Advanced from VALIDATION to DONE"
    }
  ],
  "source_task_file": "TODO/tasks/L3-agent-orchestration.md",
  "tags": [
    "handoffs",
    "sdlc",
    "P1"
  ]
}
